{
  "$schema":"https://json-schema.org/draft/2020-12/schema","$id":"fixture-reconciliation.schema.json","type":"object","additionalProperties":false,
  "required":["contractVersion","matchRun","sourceSnapshots","configuration","counts","coverage","decisions","candidates","stabilityDiagnostic","warnings","generatedAt"],
  "properties":{"contractVersion":{"const":"1.0"},"matchRun":{"$ref":"#/$defs/run"},"sourceSnapshots":{"type":"object","additionalProperties":false,"required":["forebet","statarea"],"properties":{"forebet":{"$ref":"#/$defs/snapshot"},"statarea":{"$ref":"#/$defs/snapshot"}}},"configuration":{"type":"object","additionalProperties":false,"required":["code","status","hash","value"],"properties":{"code":{"const":"OU25-MATCHER"},"status":{"const":"DRAFT"},"hash":{"$ref":"#/$defs/hash"},"value":{"type":"object"}}},"counts":{"$ref":"#/$defs/counts"},"coverage":{"type":"object","additionalProperties":false,"required":["forebet","statarea"],"properties":{"forebet":{"type":"number","minimum":0,"maximum":1},"statarea":{"type":"number","minimum":0,"maximum":1}}},"decisions":{"type":"array","items":{"$ref":"#/$defs/decision"}},"candidates":{"type":"array","items":{"$ref":"#/$defs/candidate"}},"stabilityDiagnostic":{"anyOf":[{"type":"null"},{"type":"object"}]},"warnings":{"type":"array","items":{"type":"string","maxLength":300}},"generatedAt":{"type":"string","format":"date-time"}},
  "$defs":{"hash":{"type":"string","pattern":"^[a-f0-9]{64}$"},"run":{"type":"object","additionalProperties":false,"required":["id","sportDate","runType","status","matcherVersion","normalizerVersion","configurationHash","createdAt"],"properties":{"id":{"type":"string","minLength":1},"sportDate":{"type":"string","format":"date"},"runType":{"enum":["PRIMARY","STABILITY_DIAGNOSTIC"]},"status":{"const":"COMPLETED"},"matcherVersion":{"type":"string"},"normalizerVersion":{"type":"string"},"configurationHash":{"$ref":"#/$defs/hash"},"createdAt":{"type":"string","format":"date-time"}}},"snapshot":{"type":"object","additionalProperties":false,"required":["id","sha256","rowCount"],"properties":{"id":{"type":"string"},"sha256":{"$ref":"#/$defs/hash"},"rowCount":{"type":"integer","minimum":0}}},"counts":{"type":"object","additionalProperties":false,"required":["forebetInput","statareaInput","matched","ambiguous","onlyForebet","onlyStatarea","conflict","exact","conservative","approximate"],"properties":{"forebetInput":{"type":"integer","minimum":0},"statareaInput":{"type":"integer","minimum":0},"matched":{"type":"integer","minimum":0},"ambiguous":{"type":"integer","minimum":0},"onlyForebet":{"type":"integer","minimum":0},"onlyStatarea":{"type":"integer","minimum":0},"conflict":{"type":"integer","minimum":0},"exact":{"type":"integer","minimum":0},"conservative":{"type":"integer","minimum":0},"approximate":{"type":"integer","minimum":0}}},"decision":{"type":"object","additionalProperties":false,"required":["id","status","forebetObservationId","statareaRowId","selectedCandidateId","reasonCode","reasons","warnings","confidenceClass","identity"],"properties":{"id":{"type":"string"},"status":{"enum":["MATCHED","AMBIGUOUS","ONLY_FOREBET","ONLY_STATAREA","CONFLICT"]},"forebetObservationId":{"type":["string","null"]},"statareaRowId":{"type":["string","null"]},"selectedCandidateId":{"type":["string","null"]},"reasonCode":{"type":"string","minLength":1},"reasons":{"type":"array","items":{"type":"string"}},"warnings":{"type":"array","items":{"type":"string"}},"confidenceClass":{"enum":["EXACT","STRONG","REVIEW","UNRESOLVED"]},"identity":{"type":"object"}}},"candidate":{"type":"object","additionalProperties":false,"required":["id","forebetObservationId","statareaRowId","orientation","homeScore","awayScore","aggregateScore","marginToSecond","stage","rank","evidence","rejectionReasons"],"properties":{"id":{"type":"string"},"forebetObservationId":{"type":"string"},"statareaRowId":{"type":"string"},"orientation":{"enum":["DIRECT","REVERSED"]},"homeScore":{"type":"number","minimum":0,"maximum":1},"awayScore":{"type":"number","minimum":0,"maximum":1},"aggregateScore":{"type":"number","minimum":0,"maximum":1},"marginToSecond":{"type":["number","null"]},"stage":{"enum":["EXACT","CONSERVATIVE","APPROXIMATE","CONFLICT"]},"rank":{"type":"integer","minimum":1},"evidence":{"type":"object"},"rejectionReasons":{"type":"array","items":{"type":"string"}}}}
}
}
