{"contractVersion":"1.0","matchRun":{"id":"run","sportDate":"2026-07-21","runType":"PRIMARY","status":"COMPLETED","matcherVersion":"1","normalizerVersion":"1","configurationHash":"aaaaaaaaaaaaaaaaaaaaaaaaaaaaaaaaaaaaaaaaaaaaaaaaaaaaaaaaaaaaaaaa","createdAt":"2026-07-22T00:00:00.000Z"},"sourceSnapshots":{"forebet":{"id":"f","sha256":"bbbbbbbbbbbbbbbbbbbbbbbbbbbbbbbbbbbbbbbbbbbbbbbbbbbbbbbbbbbbbbbb","rowCount":1},"statarea":{"id":"s","sha256":"cccccccccccccccccccccccccccccccccccccccccccccccccccccccccccccccc","rowCount":1}},"configuration":{"code":"OU25-MATCHER","status":"DRAFT","hash":"aaaaaaaaaaaaaaaaaaaaaaaaaaaaaaaaaaaaaaaaaaaaaaaaaaaaaaaaaaaaaaaa","value":{}},"counts":{"forebetInput":1,"statareaInput":1,"matched":1,"ambiguous":0,"onlyForebet":0,"onlyStatarea":0,"conflict":0,"exact":1,"conservative":0,"approximate":0},"coverage":{"forebet":1,"statarea":1},"decisions":[{"id":"d","status":"MATCHED","forebetObservationId":"f1","statareaRowId":"s1","selectedCandidateId":"c1","reasonCode":"EXACT","reasons":[],"warnings":[],"confidenceClass":"EXACT","identity":{"forebet":{"homeRaw":"A","awayRaw":"B","competitionRaw":null,"countryRaw":null,"homeNormalized":"a","awayNormalized":"b"},"statarea":{"homeRaw":"A","awayRaw":"B","competitionRaw":null,"countryRaw":null,"homeNormalized":"a","awayNormalized":"b"}}}],"candidates":[{"id":"c1","forebetObservationId":"f1","statareaRowId":"s1","orientation":"DIRECT","homeScore":1,"awayScore":1,"aggregateScore":1,"marginToSecond":1,"stage":"EXACT","rank":1,"evidence":{},"rejectionReasons":[]}],"stabilityDiagnostic":null,"warnings":[],"generatedAt":"2026-07-22T00:00:00.000Z"}
